{
  "schema": "raios.experience.v9",
  "experience_id": "202acc8ef67e7278e0a09a172e3618392c298c9971aa9748ae90d5c718a3a9e0",
  "timestamp": "2026-08-18T06:11:00.356212+00:00",
  "intent": "Bootstrap RAIOS V9 recursive cognitive architecture",
  "context": {
    "repository": "C:\\Users\\Ghanam\\Documents\\Codex\\Greeny-Life-Repair",
    "branch": "codex-clean",
    "repository_sha": "fb130e232246a00b531835f529f25e4edfae2854",
    "v9_phase": "V9.0-A"
  },
  "plan": [],
  "tools": [
    "PowerShell",
    "Git",
    "Python"
  ],
  "observations": [
    "V9 must learn from the process used to build V9 itself.",
    "Current observed Kaggle runtime is CPU-only and T4 is not available."
  ],
  "failures": [],
  "corrections": [],
  "result": {
    "status": "RECORDED"
  },
  "evidence": [
    "RAIOS/V9/architecture/RAIOS-V9-ARCHITECTURE.md",
    "RAIOS/V9/schemas/EXPERIENCE.schema.json"
  ],
  "lesson": [
    "Meaningful operations must create structured Experience records rather than logs alone.",
    "Background cognition may generate candidates but must not silently mutate canonical state."
  ],
  "reusability": {
    "assessment": "UNASSESSED",
    "repeat_count": 1,
    "candidate_for_compilation": false
  },
  "skill_candidate": null,
  "status": "PENDING_VALIDATION"
}
